{
  "task_id": "issue-249",
  "workflow_id": "bug-fix",
  "contract_version": 1,
  "change_type": "bug-fix",
  "risk_level": "medium",
  "state": "verifying",
  "rework_count": 0,
  "max_rework_attempts": 2,
  "history": [
    {
      "from": "intake",
      "to": "investigating",
      "at": "2026-09-09",
      "actor": "Developer Agent",
      "evidence_refs": ["failure_description", "repro"]
    },
    {
      "from": "investigating",
      "to": "implementing",
      "at": "2026-09-09",
      "actor": "Developer Agent",
      "evidence_refs": ["fail_path", "hypothesis_matrix"]
    },
    {
      "from": "implementing",
      "to": "verifying",
      "at": "2026-09-09",
      "actor": "Developer Agent",
      "evidence_refs": ["changed_files", "validation_plan"]
    }
  ],
  "evidence": {
    "failure_description": "Issue #249: raw text flag extraction hijacked by quoted title",
    "repro": "Issue #249 regression fixture",
    "fail_path": "Raw regex in extractBodyFromCommand ignores quoted argument boundaries",
    "hypothesis_matrix": "Issue #249 regression fixture",
    "changed_files": ["scripts/validate-pr-readiness.mjs", "test/validate-pr-readiness.test.mjs", "README.md"],
    "validation_plan": "Issue #249 regression fixture"
  },
  "next_route": "qa-agent",
  "stop_reason": null
}
